{
  "$schema": "https://json-schema.org/draft/2020-12/schema",
  "$id": "https://raw.githubusercontent.com/api-evangelist/pokeapi/refs/heads/main/json-schema/pokeapi-version-group-schema.json",
  "title": "VersionGroup",
  "description": "Pok\u00e9API VersionGroup schema.",
  "type": "object",
  "properties": {
    "id": {
      "type": "integer"
    },
    "name": {
      "type": "string"
    },
    "order": {
      "type": "integer"
    },
    "generation": {
      "type": "object",
      "properties": {
        "name": {
          "type": "string",
          "description": "Slug name of the referenced resource."
        },
        "url": {
          "type": "string",
          "format": "uri",
          "description": "Canonical URL of the referenced resource."
        }
      }
    },
    "move_learn_methods": {
      "type": "array",
      "items": {
        "type": "object",
        "properties": {
          "name": {
            "type": "string",
            "description": "Slug name of the referenced resource."
          },
          "url": {
            "type": "string",
            "format": "uri",
            "description": "Canonical URL of the referenced resource."
          }
        }
      }
    },
    "pokedexes": {
      "type": "array",
      "items": {
        "type": "object",
        "properties": {
          "name": {
            "type": "string",
            "description": "Slug name of the referenced resource."
          },
          "url": {
            "type": "string",
            "format": "uri",
            "description": "Canonical URL of the referenced resource."
          }
        }
      }
    },
    "regions": {
      "type": "array",
      "items": {
        "type": "object",
        "properties": {
          "name": {
            "type": "string",
            "description": "Slug name of the referenced resource."
          },
          "url": {
            "type": "string",
            "format": "uri",
            "description": "Canonical URL of the referenced resource."
          }
        }
      }
    },
    "versions": {
      "type": "array",
      "items": {
        "type": "object",
        "properties": {
          "name": {
            "type": "string",
            "description": "Slug name of the referenced resource."
          },
          "url": {
            "type": "string",
            "format": "uri",
            "description": "Canonical URL of the referenced resource."
          }
        }
      }
    }
  }
}