{
  "id": 1,
  "name": "example",
  "order": 1,
  "generation": {
    "name": "example",
    "url": "https://pokeapi.co/api/v2/example/1/"
  },
  "move_learn_methods": [
    {
      "name": "example",
      "url": "https://pokeapi.co/api/v2/example/1/"
    }
  ],
  "pokedexes": [
    {
      "name": "example",
      "url": "https://pokeapi.co/api/v2/example/1/"
    }
  ],
  "regions": [
    {
      "name": "example",
      "url": "https://pokeapi.co/api/v2/example/1/"
    }
  ],
  "versions": [
    {
      "name": "example",
      "url": "https://pokeapi.co/api/v2/example/1/"
    }
  ]
}